{"$schema":"https://json-schema.org/draft/2020-12/schema","title":"Software Inc Mod Studio Eval Record","type":"array","items":{"type":"object","required":["id","title","category","severity","prompt","required_assertions","forbidden_assertions","pass_rule"],"properties":{"id":{"type":"string","minLength":2},"title":{"type":"string","minLength":1},"category":{"type":"string","minLength":1},"severity":{"enum":["P0","P1","P2","P3"]},"canonical_severity":{"type":"string"},"prompt":{"type":"string","minLength":1},"required_assertions":{"type":"array","minItems":1,"items":{"type":"string","minLength":1}},"forbidden_assertions":{"type":"array","minItems":1,"items":{"type":"string","minLength":1}},"pass_rule":{"type":"string","minLength":1}},"additionalProperties":false}}
